{
  "claim": {
    "evidence_type": "assignment_dispatch_claim",
    "path": "reviews/.harness/assignment/dispatch/claims/dispatch-f65a1534b5b88b9d/claim.json",
    "root": {
      "discovery": "explicit:project_manifest.json",
      "identity": "c5-terminal-lifecycle-fixture",
      "kind": "project",
      "manifest_sha256": "5e28741d3c167321b0374962c13b5251b27b1d472106f18a5b6d906e1df7bc46"
    },
    "sha256": "20353b71de8844c9c79f016bb72764dae8c1913b705d38b62e5ae51eb5ce3c03"
  },
  "claim_id": "dispatch-f65a1534b5b88b9d",
  "consumed_at": "2026-07-26T00:00:05Z",
  "consumer_transaction_id": "scholarly-evaluation:SET-TERMINAL_M4",
  "consumption_id": "consume-bc0aa7d853c75fdc",
  "consumption_type": "assignment_dispatch",
  "mutation_head": "785e2c3f6df42930d8498fd789553f9c0e27c3a1dbbd5d43161c108ea11e23f1",
  "mutation_row_hashes": [
    "64b67d0dfce113f29f4bb7b00d3509842b327b28b1bf7e8218737e502d7fcdaa",
    "785e2c3f6df42930d8498fd789553f9c0e27c3a1dbbd5d43161c108ea11e23f1"
  ],
  "nonce": "ddbbcf148a78e8c9d960b59f671b5c9d",
  "postimages": [
    {
      "path": "research_notes/m4_deliverable.md",
      "sha256": "d406bdac4738ce8a1836fe58925e43b90378596e8fc38263e82402b2b5d07ec5",
      "size": 329
    },
    {
      "path": "research_notes/terminal-m4-scholarly-evaluation.json",
      "sha256": "7cdeb661eea4c55a175ef5a77523c18afdd8f0c161a21aaed90597e7012b398a",
      "size": 6576
    }
  ],
  "role": "evaluator",
  "schema_version": "1.0.0",
  "state": "consumed"
}
