{
  "claim": {
    "evidence_type": "assignment_dispatch_claim",
    "path": "reviews/.harness/assignment/dispatch/claims/dispatch-06eda12b2f5c023b/claim.json",
    "root": {
      "discovery": "explicit:project_manifest.json",
      "identity": "c5-terminal-lifecycle-fixture",
      "kind": "project",
      "manifest_sha256": "5e28741d3c167321b0374962c13b5251b27b1d472106f18a5b6d906e1df7bc46"
    },
    "sha256": "31bff3110826655a52d208d39020972fa2ab69f1090142ab8809a217ba87339e"
  },
  "claim_id": "dispatch-06eda12b2f5c023b",
  "consumed_at": "2026-07-25T12:00:01Z",
  "consumer_transaction_id": "assignment-write-FINAL",
  "consumption_id": "consume-41fd025386b5b87b",
  "consumption_type": "assignment_dispatch",
  "mutation_head": "82017cb2f9cdee595a1911c5969204b606bbffe91c96db5b2e07a4efc9171cf9",
  "mutation_row_hashes": [
    "82017cb2f9cdee595a1911c5969204b606bbffe91c96db5b2e07a4efc9171cf9"
  ],
  "nonce": "b1ac10d77ee1543a8c30f27d46fdfeb9",
  "postimages": [
    {
      "path": "research_notes/m5_deliverable.md",
      "sha256": "1f1fcd21699475f9b844feb0f248dea00764d9301da6131aa0fb05158f4c276a",
      "size": 329
    }
  ],
  "role": "generator",
  "schema_version": "1.0.0",
  "state": "consumed"
}
