{
  "claim": {
    "evidence_type": "assignment_dispatch_claim",
    "path": "reviews/.harness/assignment/dispatch/claims/dispatch-3da88bc9f933b636/claim.json",
    "root": {
      "discovery": "explicit:project_manifest.json",
      "identity": "c5-terminal-lifecycle-fixture",
      "kind": "project",
      "manifest_sha256": "5e28741d3c167321b0374962c13b5251b27b1d472106f18a5b6d906e1df7bc46"
    },
    "sha256": "e9fc5ddd1a58bdd49ce9a338c30f14b23ed286eee274462a6aaf1b5244ec167a"
  },
  "claim_id": "dispatch-3da88bc9f933b636",
  "consumed_at": "2026-07-26T00:00:05Z",
  "consumer_transaction_id": "scholarly-evaluation:SET-TERMINAL_M4",
  "consumption_id": "consume-3837ea722c1c3fe6",
  "consumption_type": "assignment_dispatch",
  "mutation_head": "9620b985a3cf301e6437cd7fd9bdd0db942866bbfd46a2b530b992cfa2c818d0",
  "mutation_row_hashes": [
    "e46b44a10c7ac23cc94e56ad1b760b4229286223ae05ec7111cf80018e764f67",
    "9620b985a3cf301e6437cd7fd9bdd0db942866bbfd46a2b530b992cfa2c818d0"
  ],
  "nonce": "b5a321bca4bc7e9570bf72e2fd465feb",
  "postimages": [
    {
      "path": "research_notes/m4_deliverable.md",
      "sha256": "d406bdac4738ce8a1836fe58925e43b90378596e8fc38263e82402b2b5d07ec5",
      "size": 329
    },
    {
      "path": "research_notes/terminal-m4-scholarly-evaluation.json",
      "sha256": "84b75212ccc65d3d1b8de913a81971d64b16a5eda9e76895bfa96cda7d17866b",
      "size": 6576
    }
  ],
  "role": "evaluator",
  "schema_version": "1.0.0",
  "state": "consumed"
}
