{
  "claim": {
    "evidence_type": "assignment_dispatch_claim",
    "path": "reviews/.harness/assignment/dispatch/claims/dispatch-90cb862dd683e178/claim.json",
    "root": {
      "discovery": "explicit:project_manifest.json",
      "identity": "c5-milestone-lifecycle-fixture",
      "kind": "project",
      "manifest_sha256": "c70336a03bd82e405971f5b03e2ec7c6ff6682a254f2e1685ea32a90e9763fd7"
    },
    "sha256": "8d6119a748f0e2d478b8b2f5ccb679364948fdf8565d391caa25009b2585ae28"
  },
  "claim_id": "dispatch-90cb862dd683e178",
  "consumed_at": "2026-07-26T00:00:05Z",
  "consumer_transaction_id": "scholarly-evaluation:SET-M1_INITIAL",
  "consumption_id": "consume-005ea2a5d103077b",
  "consumption_type": "assignment_dispatch",
  "mutation_head": "955043a424153ab029ad3230b7496b276570b59e0e1208201fc7ec6bda76d15f",
  "mutation_row_hashes": [
    "dad13c52f6ca93e06259f86d15de6f77d00a4a3d3f352f7b18521433fe549366",
    "955043a424153ab029ad3230b7496b276570b59e0e1208201fc7ec6bda76d15f"
  ],
  "nonce": "ac191b9357d821e3610573f192232948",
  "postimages": [
    {
      "path": "milestones/M1_project_memo.md",
      "sha256": "a0df579be3f460b17c872cfd15fc10938e1c7dda0d66b57586e760e35fd92908",
      "size": 549
    },
    {
      "path": "milestones/m1-initial-scholarly-evaluation.json",
      "sha256": "4395ab3045dfa274b34262ef2e2c26334c3139091e7fa721a48de34b52530c10",
      "size": 6515
    }
  ],
  "role": "evaluator",
  "schema_version": "1.0.0",
  "state": "consumed"
}
