{
  "claim": {
    "evidence_type": "assignment_dispatch_claim",
    "path": "reviews/.harness/assignment/dispatch/claims/dispatch-c97fc10d84b915dc/claim.json",
    "root": {
      "discovery": "explicit:project_manifest.json",
      "identity": "c5-milestone-lifecycle-fixture",
      "kind": "project",
      "manifest_sha256": "c70336a03bd82e405971f5b03e2ec7c6ff6682a254f2e1685ea32a90e9763fd7"
    },
    "sha256": "2a99c05d7397bf793c79e980aa66e7c5167152cd66c986d6ca405337e6a98b5d"
  },
  "claim_id": "dispatch-c97fc10d84b915dc",
  "consumed_at": "2026-07-19T00:00:01Z",
  "consumer_transaction_id": "assignment-write-M1",
  "consumption_id": "consume-c007eefc8e47754b",
  "consumption_type": "assignment_dispatch",
  "mutation_head": "dad13c52f6ca93e06259f86d15de6f77d00a4a3d3f352f7b18521433fe549366",
  "mutation_row_hashes": [
    "dad13c52f6ca93e06259f86d15de6f77d00a4a3d3f352f7b18521433fe549366"
  ],
  "nonce": "ba65231ca6d635c08000ac926ae05ba6",
  "postimages": [
    {
      "path": "milestones/M1_project_memo.md",
      "sha256": "a0df579be3f460b17c872cfd15fc10938e1c7dda0d66b57586e760e35fd92908",
      "size": 549
    }
  ],
  "role": "generator",
  "schema_version": "1.0.0",
  "state": "consumed"
}
