{
  "claim": {
    "evidence_type": "assignment_dispatch_claim",
    "path": "reviews/.harness/assignment/dispatch/claims/dispatch-f1f4c473a58b1803/claim.json",
    "root": {
      "discovery": "explicit:project_manifest.json",
      "identity": "c5-terminal-lifecycle-fixture",
      "kind": "project",
      "manifest_sha256": "5e28741d3c167321b0374962c13b5251b27b1d472106f18a5b6d906e1df7bc46"
    },
    "sha256": "b284f843f488872d88a4759c1d416e287d32a31ce83d4c90169b0d90b5d77ac6"
  },
  "claim_id": "dispatch-f1f4c473a58b1803",
  "consumed_at": "2026-07-25T12:00:01Z",
  "consumer_transaction_id": "assignment-write-M3",
  "consumption_id": "consume-dd3fef7a0a14a48c",
  "consumption_type": "assignment_dispatch",
  "mutation_head": "c6d8cef0d73afd6dac41edc52580fd11b319b68e5b5e9c5084315ca3168ea3e5",
  "mutation_row_hashes": [
    "c6d8cef0d73afd6dac41edc52580fd11b319b68e5b5e9c5084315ca3168ea3e5"
  ],
  "nonce": "d753636f1a3e16f3ecc8da8241b2de4c",
  "postimages": [
    {
      "path": "research_notes/m3_deliverable.md",
      "sha256": "1121ef42a8339a21f0b443ce1689beb5f7eacc960b4a2186b97a9c6afbb13fb9",
      "size": 329
    }
  ],
  "role": "generator",
  "schema_version": "1.0.0",
  "state": "consumed"
}
